id,titulo,autores,año,fecha,serie,numero,idioma,cita_sugerida,Link,Original
27,Internet y derechos humanos. Aportes para la discusión en América Latina,Eduardo Bertoni,2014,2014-02,Compilaciones,I,ESP,"Eduardo Bertoni, “Internet y derechos humanos. Aportes para la discusión en América Latina”, Compilaciones No. I (ESP), Centro de Estudios en Libertad de Expresión (CELE), Buenos Aires (2014)",https://www.palermo.edu/cele/pdf/InternetyDDHH.pdf,
26,"Colaboración en ""Cuadernillos de Temas Emergentes"" del Instituto Nacional de Derechos Humanos de Chile",Eduardo Bertoni,2013,2013-12,Artículo de investigación,18,,"Eduardo Bertoni, “Colaboración en ""Cuadernillos de Temas Emergentes"" del Instituto Nacional de Derechos Humanos de Chile”, Artículo de investigación No. 18, Centro de Estudios en Libertad de Expresión (CELE), Buenos Aires (2013)",https://bibliotecadigital.indh.cl/bitstream/handle/123456789/627/cuadernillo?sequence=1,
25,Libertad de expresión versus libertad de expresión: la protección del derecho de autor como una tensión interna,Carlos Cortés,2013,2013-12,Artículo de investigación,17,,"Carlos Cortés, “Libertad de expresión versus libertad de expresión: la protección del derecho de autor como una tensión interna”, Artículo de investigación No. 17, Centro de Estudios en Libertad de Expresión (CELE), Buenos Aires (2013)",https://www.palermo.edu/cele/pdf/La-proteccion-del-derecho-de-autor-como-una-tension-interna.pdf,
24,La neutralidad de la red: la tensión entre la no discriminación y la gestión,Carlos Cortés,2013,2013-10,Artículo de investigación,16,,"Carlos Cortés, “La neutralidad de la red: la tensión entre la no discriminación y la gestión”, Artículo de investigación No. 16, Centro de Estudios en Libertad de Expresión (CELE), Buenos Aires (2013)",https://www.palermo.edu/cele/pdf/PaperNeutralidadFinal.pdf,
22,Las llaves del ama de llaves: la estrategia de los intermediarios en Internet y el impacto en el entorno digital,Carlos Cortés ,2013,2013-08,Artículo de investigación,14,,"Carlos Cortés , “Las llaves del ama de llaves: la estrategia de los intermediarios en Internet y el impacto en el entorno digital”, Artículo de investigación No. 14, Centro de Estudios en Libertad de Expresión (CELE), Buenos Aires (2013)",https://www.palermo.edu/cele/pdf/LasLlavesDelAmaDeLlaves.pdf,
20,Derecho al olvido: entre la protección de datos la memoria y la vida personal en la era digital,Carlos Cortés,2012,2012-12,Artículo de investigación,12,,"Carlos Cortés, “Derecho al olvido: entre la protección de datos la memoria y la vida personal en la era digital”, Artículo de investigación No. 12, Centro de Estudios en Libertad de Expresión (CELE), Buenos Aires (2012)",https://www.palermo.edu/cele/pdf/DerechoalolvidoiLEI.pdf,
19,Amicus curiae junto a Human Rights Watch ante la Corte Constitucional de Ecuador por el artículo sobre desacato del Código Penal ecuatoriano,CELE,2012,2012-11,Documento de posición,2,,"CELE, “Amicus curiae junto a Human Rights Watch ante la Corte Constitucional de Ecuador por el artículo sobre desacato del Código Penal ecuatoriano”, Documento de posición No. 2, Centro de Estudios en Libertad de Expresión (CELE), Buenos Aires (2012)",https://www.palermo.edu/Archivos_content/derecho/pdf/amicus-corte-const-ecuador-HRW-CELE-1.pdf,
18,Información pública y datos personales: una antigua tensión nuevos desafíos,Natalia Torres ,2012,2012-11,Artículo de investigación,11,,"Natalia Torres , “Información pública y datos personales: una antigua tensión nuevos desafíos”, Artículo de investigación No. 11, Centro de Estudios en Libertad de Expresión (CELE), Buenos Aires (2012)",https://www.palermo.edu/cele/pdf/DatosPersonales_Final.pdf,
17,"Informe de UNESCO ""Global survey on Internet privacy and freedom of expression""","Mendel Toby, Puddephatt Andrew, Wagner Ben, Hawtin Dixie, Torres Natalia",2012,2012-11,Informe legislativo,,,"Mendel Toby, Puddephatt Andrew, Wagner Ben, Hawtin Dixie, Torres Natalia, “Informe de UNESCO ""Global survey on Internet privacy and freedom of expression""”, Informe legislativo No. , Centro de Estudios en Libertad de Expresión (CELE), Buenos Aires (2012)",https://unesdoc.unesco.org/ark:/48223/pf0000218273,
16,Nombres de dominio: una expresión que merece ser protegida. Recomendaciones y sugerencias para administradores locales de América Latina y el mundo,Eduardo Bertoni,2012,2012-11,Artículo de investigación,10,,"Eduardo Bertoni, “Nombres de dominio: una expresión que merece ser protegida. Recomendaciones y sugerencias para administradores locales de América Latina y el mundo”, Artículo de investigación No. 10, Centro de Estudios en Libertad de Expresión (CELE), Buenos Aires (2012)",https://www.palermo.edu/cele/pdf/PaperdominiosCELEFINAL-1.pdf,
15,Calumnias e injurias: a dos años de la reforma del Código Penal argentino,Eduardo Bertoni y Agustina del Campo,2012,2012-09,Artículo de investigación,9,,"Eduardo Bertoni y Agustina del Campo, “Calumnias e injurias: a dos años de la reforma del Código Penal argentino”, Artículo de investigación No. 9, Centro de Estudios en Libertad de Expresión (CELE), Buenos Aires (2012)",https://www.palermo.edu/cele/pdf/Calumnias-e-Injurias.pdf,
14,Amicus curiae ante la Corte Constitucional de Colombia en el marco del proceso de revisión de la Ley 1520 (Ley Lleras),Eduardo Bertoni,2012,2012-08,Documento de posición,1,,"Eduardo Bertoni, “Amicus curiae ante la Corte Constitucional de Colombia en el marco del proceso de revisión de la Ley 1520 (Ley Lleras)”, Documento de posición No. 1, Centro de Estudios en Libertad de Expresión (CELE), Buenos Aires (2012)",https://www.palermo.edu/cele/pdf/Amicus-Curie-CELE.pdf,
13,Acceso a la información y seguridad nacional en América Latina,"Eduardo Bertoni, Edison Lanza, Mariana Mas, Natalia Torres",2012,2012-07,Artículo de investigación,8,,"Eduardo Bertoni, Edison Lanza, Mariana Mas, Natalia Torres, “Acceso a la información y seguridad nacional en América Latina”, Artículo de investigación No. 8, Centro de Estudios en Libertad de Expresión (CELE), Buenos Aires (2012)",https://www.palermo.edu/cele/pdf/NS-AI.pdf,
12,Vigilancia en la red: ¿qué significa monitorear y detectar contenidos en internet?,Carlos Cortés,2012,2012-07,Artículo de investigación,7,,"Carlos Cortés, “Vigilancia en la red: ¿qué significa monitorear y detectar contenidos en internet?”, Artículo de investigación No. 7, Centro de Estudios en Libertad de Expresión (CELE), Buenos Aires (2012)",https://www.palermo.edu/cele/pdf/El-deseo-de-observar-la-red.pdf,
11,Despenalización de la expresión: la experiencia argentina,Agustina Del Campo y Eduardo Bertoni,2012,2012-06,Artículo de investigación,6,,"Agustina Del Campo y Eduardo Bertoni, “Despenalización de la expresión: la experiencia argentina”, Artículo de investigación No. 6, Centro de Estudios en Libertad de Expresión (CELE), Buenos Aires (2012)",https://www.palermo.edu/Archivos_content/2020/cele/publicaciones/Despenalizacion-de-la-expresion-en-Argentina.pdf,
10,Comentarios al anteproyecto de Ley de Transparencia Acceso a la Información pública y Buen Gobierno de España,OSCE,2012,2012-04,Informe legislativo,,,"OSCE, “Comentarios al anteproyecto de Ley de Transparencia Acceso a la Información pública y Buen Gobierno de España”, Informe legislativo No. , Centro de Estudios en Libertad de Expresión (CELE), Buenos Aires (2012)",https://www.osce.org/fom/89577,
9,Diseño institucional y efectividad de las agencias encargadas de proteger periodistas e investigar crímenes contra la prensa: México Colombia y Guatemala,Natalia Torres,2012,2012-04,Artículo de investigación,5,,"Natalia Torres, “Diseño institucional y efectividad de las agencias encargadas de proteger periodistas e investigar crímenes contra la prensa: México Colombia y Guatemala”, Artículo de investigación No. 5, Centro de Estudios en Libertad de Expresión (CELE), Buenos Aires (2012)",https://www.palermo.edu/cele/pdf/acceso-informacion/Documento1_Informe_Completo.pdf,
8,La tensión entre la protección de la propiedad intelectual y el intercambio de contenidos en la red. A propósito del caso Cuevana en Argentina y la 'Ley Lleras' en Colombia,Eduardo Bertoni y Carlos Cortés,2012,2012-03,Artículo de investigación,4,,"Eduardo Bertoni y Carlos Cortés, “La tensión entre la protección de la propiedad intelectual y el intercambio de contenidos en la red. A propósito del caso Cuevana en Argentina y la 'Ley Lleras' en Colombia”, Artículo de investigación No. 4, Centro de Estudios en Libertad de Expresión (CELE), Buenos Aires (2012)",https://www.palermo.edu/cele/pdf/investigaciones/la-tension-entre-la-proteccion-de-la-propiedad-intelectual.pdf,
7,Hacia una internet libre de censura. Propuestas para América Latina,Eduardo Bertoni,2012,2012-01,Compilaciones,I,ESP,"Eduardo Bertoni, “Hacia una internet libre de censura. Propuestas para América Latina”, Compilaciones No. I (ESP), Centro de Estudios en Libertad de Expresión (CELE), Buenos Aires (2012)",https://www.palermo.edu/cele/pdf/internet_libre_de_censura_libro.pdf,
6,Promoción del acceso a la información pública a través del sistema educativo: La experiencia de México,Andrea de la Fuente y María Rosario Soraide Durán,2011,2011-12,Artículo de investigación,3,,"Andrea de la Fuente y María Rosario Soraide Durán, “Promoción del acceso a la información pública a través del sistema educativo: La experiencia de México”, Artículo de investigación No. 3, Centro de Estudios en Libertad de Expresión (CELE), Buenos Aires (2011)",https://www.palermo.edu/cele/pdf/Promocion-AIP-sistema-educativo-Diciembre-2011.pdf,
5,El CELE presenta recomendaciones para la Ley Modelo de Acceso a la Información en África,Eduardo Bertoni,2011,2011-11,Informe legislativo,,,"Eduardo Bertoni, “El CELE presenta recomendaciones para la Ley Modelo de Acceso a la Información en África”, Informe legislativo No. , Centro de Estudios en Libertad de Expresión (CELE), Buenos Aires (2011)",https://www.palermo.edu/cele/pdf/investigaciones/AU-Draft-Model-Law-CELE.pdf,
4,Access to Information Training Approaches for Government Officials,Natalia Torres y Luis F. Esquivel,2011,2011-11,Artículo de investigación,2,,"Natalia Torres y Luis F. Esquivel, “Access to Information Training Approaches for Government Officials”, Artículo de investigación No. 2, Centro de Estudios en Libertad de Expresión (CELE), Buenos Aires (2011)",https://www.palermo.edu/cele/pdf/noticias/AI-training-final.pdf,
3,Informe técnico sobre los proyectos de ley de acceso a la información en debate en el Senado de la Nación Argentina,Eduardo Bertoni,2010,2010-09,Artículo de investigación,1,,"Eduardo Bertoni, “Informe técnico sobre los proyectos de ley de acceso a la información en debate en el Senado de la Nación Argentina”, Artículo de investigación No. 1, Centro de Estudios en Libertad de Expresión (CELE), Buenos Aires (2010)",https://www.palermo.edu/cele/pdf/noticias/recomendaciones-del-senado.pdf,
2,Recomendaciones en base al tercer proyecto de dictamen elaborado por el senador Samuel Cabanchik a la Comisión de Asuntos Constitucionales del Honorable Senado de la Nación,Eduardo Bertoni,2010,2010-09,Informe legislativo,,,"Eduardo Bertoni, “Recomendaciones en base al tercer proyecto de dictamen elaborado por el senador Samuel Cabanchik a la Comisión de Asuntos Constitucionales del Honorable Senado de la Nación”, Informe legislativo No. , Centro de Estudios en Libertad de Expresión (CELE), Buenos Aires (2010)",https://www.palermo.edu/cele/pdf/noticias/cele-cabanchik.pdf,
1,Apuntes para la presentación del profesor Eduardo Bertoni sobre el proyecto de ley de acceso a la información pública,Eduardo Bertoni,2010,2010-06,Informe legislativo,,,"Eduardo Bertoni, “Apuntes para la presentación del profesor Eduardo Bertoni sobre el proyecto de ley de acceso a la información pública”, Informe legislativo No. , Centro de Estudios en Libertad de Expresión (CELE), Buenos Aires (2010)",https://www.palermo.edu/cele/pdf/Presentacion-senado.pdf,