id,titulo,autores,año,fecha,serie,numero,idioma,cita_sugerida,Link,Original
79,Human Rights Impact Assessments: Trends Challenges And Opportunities for ICT Sector Adoption,Alejandra Castañeda y Ramiro Álvarez Ugarte,2020,2020-10,Artículo de investigación,45,ENG,"Alejandra Castañeda y Ramiro Álvarez Ugarte, “Human Rights Impact Assessments: Trends Challenges And Opportunities for ICT Sector Adoption”, Artículo de investigación No. 45 (ENG), Centro de Estudios en Libertad de Expresión (CELE), Buenos Aires (2020)",https://www.palermo.edu/Archivos_content/2021/cele/papers/Human-Rights-Impact-Assessments.pdf,
79,"Estudios de impacto en derechos humanos: Tendencias, desafíos, y oportunidades para su adopción en el sector TIC",Alejandra Castañeda y Ramiro Álvarez Ugarte,2020,2020-10,Artículo de investigación,45,ESP,"Alejandra Castañeda y Ramiro Álvarez Ugarte, “Estudios de impacto en derechos humanos: Tendencias, desafíos, y oportunidades para su adopción en el sector TIC”, Artículo de investigación No. 45 (ESP), Centro de Estudios en Libertad de Expresión (CELE), Buenos Aires (2020)",,
78,¿La desinformación en democracia o la democracia de la desinformación?,Agustina Del Campo,2020,2020-09,Artículo de investigación,44,,"Agustina Del Campo, “¿La desinformación en democracia o la democracia de la desinformación?”, Artículo de investigación No. 44, Centro de Estudios en Libertad de Expresión (CELE), Buenos Aires (2020)",https://www.palermo.edu/Archivos_content/2020/cele/septiembre/La-desinformacion-en-democracia.pdf,
77,ICT and Human Rights: Towards a Conceptual Framework of Human Rights Impact Assessments,Ramiro Álvarez Ugarte y Laura Krauer,2020,2020-08,Artículo de investigación,43,ENG,"Ramiro Álvarez Ugarte y Laura Krauer, “ICT and Human Rights: Towards a Conceptual Framework of Human Rights Impact Assessments”, Artículo de investigación No. 43 (ENG), Centro de Estudios en Libertad de Expresión (CELE), Buenos Aires (2020)",https://www.palermo.edu/Archivos_content/2021/cele/papers/ICT-and-Human-Rights.pdf,
77,TIC y Derechos Humanos: Hacia un marco conceptual de los estudios de impacto en derechos humanos,Ramiro Álvarez Ugarte y Laura Krauer,2020,2020-08,Artículo de investigación,43,ESP,"Ramiro Álvarez Ugarte y Laura Krauer, “TIC y Derechos Humanos: Hacia un marco conceptual de los estudios de impacto en derechos humanos”, Artículo de investigación No. 43 (ESP), Centro de Estudios en Libertad de Expresión (CELE), Buenos Aires (2020)",,
76,Libertad de expresión y brecha digital de género en México,Priscilla Ruiz y Vladimir Cortés,2020,2020-07,Artículo de investigación,42,,"Priscilla Ruiz y Vladimir Cortés, “Libertad de expresión y brecha digital de género en México”, Artículo de investigación No. 42, Centro de Estudios en Libertad de Expresión (CELE), Buenos Aires (2020)",https://www.palermo.edu/Archivos_content/2020/cele/octubre/libertad-expresion/Libertad-de-expresion-y-brecha-digital-de-genero-en-Mexico.pdf,
76,Ruling by bullying: Threats of regulation as an internet governance device,Ramiro Álvarez Ugarte,2026,2026-02-09,Trabajos publicados,,,"Ramiro Álvarez Ugarte, Ruling by bullying: Threats of regulation as an internet governance device. Internet Policy Review, Vol. 15, No. 1 (2026). ",,
75,Internet and Human Rights III. Contributions to the discussion in Latin America.,Agustina Del Campo,2020,2020-03,Compilaciones,III,ENG,"Agustina Del Campo, “Internet and Human Rights III. Contributions to the discussion in Latin America.”, Compilaciones No. III (ENG), Centro de Estudios en Libertad de Expresión (CELE), Buenos Aires (2020)",https://www.palermo.edu/Archivos_content/2020/cele/marzo/Libro-Internet-and-Human-Rights-III.pdf,
74,Internet y derechos humanos III. Aportes para la discusión en América Latina,Agustina Del Campo,2020,2020-03,Compilaciones,III,ESP,"Agustina Del Campo, “Internet y derechos humanos III. Aportes para la discusión en América Latina”, Compilaciones No. III (ESP), Centro de Estudios en Libertad de Expresión (CELE), Buenos Aires (2020)",https://www.palermo.edu/Archivos_content/2020/cele/marzo/Internet_y_Derechos_HumanosIII.pdf,
73,El desarrollo institucional en la gobernanza de internet y la participación en la sociedad civil,Diego R. Canabarro,2019,2019-12,Artículo de investigación,41,,"Diego R. Canabarro, “El desarrollo institucional en la gobernanza de internet y la participación en la sociedad civil”, Artículo de investigación No. 41, Centro de Estudios en Libertad de Expresión (CELE), Buenos Aires (2019)",https://www.palermo.edu/Archivos_content/2020/cele/agosto/El-desarrollo-institucional-PADF-Canabarro.pdf,
72,Estado democrático de derecho y la gobernanza de internet,Guilherme Canela,2019,2019-12,Artículo de investigación,40,,"Guilherme Canela, “Estado democrático de derecho y la gobernanza de internet”, Artículo de investigación No. 40, Centro de Estudios en Libertad de Expresión (CELE), Buenos Aires (2019)",https://www.palermo.edu/Archivos_content/2020/cele/agosto/Estado-democratico-de-derecho-PADF-Canela.pdf,
71,Del cómic a los memes: viejas y nuevas problemáticas en torno al humor y la libertad de expresión,Agustina Del Campo y Paula Roko,2019,2019-11,Artículo de investigación,39,,"Agustina Del Campo y Paula Roko, “Del cómic a los memes: viejas y nuevas problemáticas en torno al humor y la libertad de expresión”, Artículo de investigación No. 39, Centro de Estudios en Libertad de Expresión (CELE), Buenos Aires (2019)",https://www.palermo.edu/Archivos_content/2019/cele/noviembre/Humor-y-libertad-de-expresion.pdf,
70,Libertad de expresión y de discurso en Chile: desafíos y tensiones en el tránsito hacia una sociedad digital,Patricia Peña,2019,2019-10,Informe legislativo,,,"Patricia Peña, “Libertad de expresión y de discurso en Chile: desafíos y tensiones en el tránsito hacia una sociedad digital”, Informe legislativo No. , Centro de Estudios en Libertad de Expresión (CELE), Buenos Aires (2019)",https://www.palermo.edu/Archivos_content/2019/cele/octubre/libertad-de-expresion-y-discurso-Chile.pdf,
69,Tendencias de la libertad de expresión en Colombia,Luisa Fernanda Isaza,2019,2019-10,Informe legislativo,,,"Luisa Fernanda Isaza, “Tendencias de la libertad de expresión en Colombia”, Informe legislativo No. , Centro de Estudios en Libertad de Expresión (CELE), Buenos Aires (2019)",https://www.palermo.edu/Archivos_content/2019/cele/octubre/Tendencias-de-la-libertad-de-expresion-en-Colombia.pdf,
68,Tendencias en libertad de expresión en Guatemala,Álvaro Castellanos Howell,2019,2019-10,Informe legislativo,12,,"Álvaro Castellanos Howell, “Tendencias en libertad de expresión en Guatemala”, Informe legislativo No. 12, Centro de Estudios en Libertad de Expresión (CELE), Buenos Aires (2019)",https://www.palermo.edu/Archivos_content/2019/cele/octubre/Tendencias-de-la-libertad-de-expresion-en-Guatemala.pdf,
67,Tendencias legislativas sobre libertad de expresión e internet en Paraguay,Camilo J. Filártiga Callizo,2019,2019-10,Informe legislativo,11,,"Camilo J. Filártiga Callizo, “Tendencias legislativas sobre libertad de expresión e internet en Paraguay”, Informe legislativo No. 11, Centro de Estudios en Libertad de Expresión (CELE), Buenos Aires (2019)",https://www.palermo.edu/Archivos_content/2019/cele/octubre/Tendencias-legislativas-en-Paraguay.pdf,
66,Los guardianes de la ley de Acceso a la Información Pública: análisis sobre la implementación de los órganos garantes,Agustina Del Campo y Franco Serra,2019,2019-09,Artículo de investigación,38,,"Agustina Del Campo y Franco Serra, “Los guardianes de la ley de Acceso a la Información Pública: análisis sobre la implementación de los órganos garantes”, Artículo de investigación No. 38, Centro de Estudios en Libertad de Expresión (CELE), Buenos Aires (2019)",https://www.palermo.edu/Archivos_content/2019/cele/octubre/Los-guardianes-ley-de-acceso-info.pdf,
65,Towards an Internet Free of Censorship III: standards contexts and lessons from the Inter-American Human Rights System,Agustina Del Campo,2019,2019-09,Compilaciones,III,ENG,"Agustina Del Campo, “Towards an Internet Free of Censorship III: standards contexts and lessons from the Inter-American Human Rights System”, Compilaciones No. III (ENG), Centro de Estudios en Libertad de Expresión (CELE), Buenos Aires (2019)",https://www.palermo.edu/Archivos_content/2019/cele/Mayo/Towards-an-internet-free-of-censorship-Web.pdf,
64,Considering Facebook Oversight Board: turning on expectations,Agustina Del Campo,2019,2019-05,Artículo de investigación,37,,"Agustina Del Campo, “Considering Facebook Oversight Board: turning on expectations”, Artículo de investigación No. 37, Centro de Estudios en Libertad de Expresión (CELE), Buenos Aires (2019)",https://www.palermo.edu/Archivos_content/2019/cele/Junio/Considering-Facebook-Oversight-Board.pdf,
63,Hacia una internet libre de censura III: estándares contextos y aprendizajes en el Sistema Interamericano,Agustina Del Campo,2019,2019-05,Compilaciones,III,ESP,"Agustina Del Campo, “Hacia una internet libre de censura III: estándares contextos y aprendizajes en el Sistema Interamericano”, Compilaciones No. III (ESP), Centro de Estudios en Libertad de Expresión (CELE), Buenos Aires (2019)",https://www.palermo.edu/Archivos_content/2019/cele/Mayo/Hacia-una-Internet-libre-de-censura-III.pdf,
62,Secretos y mentiras: WhatsApp y las redes sociales en las elecciones presidenciales de Brasil en 2018,"Esther Solano, Francisco Brito Cruz, Helena Martins, João Brant, Mariana Valente y Rafael Zanatta",2019,2019-05,Artículo de investigación,36,,"Esther Solano, Francisco Brito Cruz, Helena Martins, João Brant, Mariana Valente y Rafael Zanatta, “Secretos y mentiras: WhatsApp y las redes sociales en las elecciones presidenciales de Brasil en 2018”, Artículo de investigación No. 36, Centro de Estudios en Libertad de Expresión (CELE), Buenos Aires (2019)",https://www.palermo.edu/Archivos_content/2020/cele/febrero/Secretos-y-mentiras-WhatsApp-y-las-redes-sociales%20.pdf,
61,WhatsApp política móvil y desinformación: ¿cómo se dio la viralización de las noticias falsas en las elecciones brasileñas?,João Guilherme Bastos dos Santos y Miguel Freitas,2019,2019-05,Artículo de investigación,35,,"João Guilherme Bastos dos Santos y Miguel Freitas, “WhatsApp política móvil y desinformación: ¿cómo se dio la viralización de las noticias falsas en las elecciones brasileñas?”, Artículo de investigación No. 35, Centro de Estudios en Libertad de Expresión (CELE), Buenos Aires (2019)",https://www.palermo.edu/Archivos_content/2020/cele/febrero/WhatsApp-politica-movil-y-desinformacion.pdf,
60,Los discursos de odio como amenaza a los derechos humanos,Natalia Torres y Víctor Taricco,2019,2019-04,Artículo de investigación,34,,"Natalia Torres y Víctor Taricco, “Los discursos de odio como amenaza a los derechos humanos”, Artículo de investigación No. 34, Centro de Estudios en Libertad de Expresión (CELE), Buenos Aires (2019)",https://www.palermo.edu/Archivos_content/2019/cele/Abril/Los-discursos-de-odio_Torres-y-Taricco.pdf,
59,"Implementing ""Digital Oblivion"": Forgetting Details",Carlos Cortés and Luisa Fernanda Isaza,2018,2018-12,Artículo de investigación,33,ENG,"Carlos Cortés and Luisa Fernanda Isaza, “Implementing ""Digital Oblivion"": Forgetting Details”, Artículo de investigación No. 33 (ENG), Centro de Estudios en Libertad de Expresión (CELE), Buenos Aires (2018)",https://www.palermo.edu/Archivos_content/2019/cele/Mayo/Implementing-Digital-Oblivion-Forgetting-Details.pdf,
58,"La implementación del ""olvido digital"": el olvido de los detalles",Carlos Cortés y Luisa Fernanda Isaz,2018,2018-12,Artículo de investigación,33,ESP,"Carlos Cortés y Luisa Fernanda Isaz, “La implementación del ""olvido digital"": el olvido de los detalles”, Artículo de investigación No. 33 (ESP), Centro de Estudios en Libertad de Expresión (CELE), Buenos Aires (2018)",https://www.palermo.edu/cele/libertad-de-expresion/pdf/La-implementacion-del-olvido-digital-CELE-enero-2019.pdf,
57,Libertad de expresión e internet,Agustina Del Campo,2018,2018-05,Compilaciones,,ESP,"Agustina Del Campo, “Libertad de expresión e internet”, Compilaciones No.  (ESP), Centro de Estudios en Libertad de Expresión (CELE), Buenos Aires (2018)",https://www.palermo.edu/cele/pdf/Libertad-de-expresion-e-internet.pdf,
56,Tendencias en libertad de expresión en Argentina,CELE,2018,2018-03,Informe legislativo,,,"CELE, “Tendencias en libertad de expresión en Argentina”, Informe legislativo No. , Centro de Estudios en Libertad de Expresión (CELE), Buenos Aires (2018)",https://www.palermo.edu/cele/pdf/Libertad_de_expresion_en_Argentina.pdf,
55,Tendencias en libertad de expresión en Ecuador,CELE,2018,2018-03,Informe legislativo,,,"CELE, “Tendencias en libertad de expresión en Ecuador”, Informe legislativo No. , Centro de Estudios en Libertad de Expresión (CELE), Buenos Aires (2018)",https://www.palermo.edu/cele/pdf/Libertad_de_expresion_en_Ecuador.pdf,
54,Tendencias en libertad de expresión en México,CELE,2018,2018-03,Informe legislativo,,,"CELE, “Tendencias en libertad de expresión en México”, Informe legislativo No. , Centro de Estudios en Libertad de Expresión (CELE), Buenos Aires (2018)",https://www.palermo.edu/cele/pdf/Libertad_de_expresion_en_Mexico.pdf,
53,Tendencias en libertad de expresión en Perú,CELE,2018,2018-03,Informe legislativo,,,"CELE, “Tendencias en libertad de expresión en Perú”, Informe legislativo No. , Centro de Estudios en Libertad de Expresión (CELE), Buenos Aires (2018)",https://www.palermo.edu/cele/pdf/Libertad_de_expresion_en_Peru.pdf,
52,Content Moderation and private censorship: standards drawn from the jurisprudence of the Inter-American Human Rights system,Agustina Del Campo,2017,2017-12,Artículo de investigación,32,,"Agustina Del Campo, “Content Moderation and private censorship: standards drawn from the jurisprudence of the Inter-American Human Rights system”, Artículo de investigación No. 32, Centro de Estudios en Libertad de Expresión (CELE), Buenos Aires (2017)",https://www.palermo.edu/cele/pdf/Content_Moderation.pdf,
51,Criminalization of Discriminatory Expression in the Americas: The Case of Non-Consensual Pornography Regulation in Argentina,Paula Vargas,2017,2017-12,Artículo de investigación,31,,"Paula Vargas, “Criminalization of Discriminatory Expression in the Americas: The Case of Non-Consensual Pornography Regulation in Argentina”, Artículo de investigación No. 31, Centro de Estudios en Libertad de Expresión (CELE), Buenos Aires (2017)",https://www.palermo.edu/cele/pdf/Policy_Brief_Non_Consensual_Pornography.pdf,
50,Fake news on the internet: the strategy to battle misinformation,Carlos Cortés y Luisa Isaza,2017,2017-12,Artículo de investigación,30,ENG,"Carlos Cortés y Luisa Isaza, “Fake news on the internet: the strategy to battle misinformation”, Artículo de investigación No. 30 (ENG), Centro de Estudios en Libertad de Expresión (CELE), Buenos Aires (2017)",https://www.palermo.edu/Archivos_content/2019/cele/Mayo/Fake-news-strategy-to-battle-misinformation.pdf,
49,Noticias falsas en internet: la estrategia para combatir la desinformación,Carlos Cortés y Luisa Isaza,2017,2017-12,Artículo de investigación,30,ESP,"Carlos Cortés y Luisa Isaza, “Noticias falsas en internet: la estrategia para combatir la desinformación”, Artículo de investigación No. 30 (ESP), Centro de Estudios en Libertad de Expresión (CELE), Buenos Aires (2017)",https://www.palermo.edu/cele/pdf/FakeNews.pdf,
48,Guía para jueces y periodistas: mejores prácticas para orientar el diálogo entre el Poder Judicial y la prensa,"Organización de las Naciones Unidas para la Educación, la Ciencia y la Cultura y la Oficina Regional de Ciencias de la UNESCO",2017,2017-11,Trabajos publicados,,,"Organización de las Naciones Unidas para la Educación, la Ciencia y la Cultura y la Oficina Regional de Ciencias de la UNESCO, “Guía para jueces y periodistas: mejores prácticas para orientar el diálogo entre el Poder Judicial y la prensa”, Trabajos publicados No. , Centro de Estudios en Libertad de Expresión (CELE), Buenos Aires (2017)",https://www.palermo.edu/cele/libertad-de-expresion/Guia_para_jueces_y_periodistas.pdf,
47,Amicus curiae ante la Corte Suprema en el caso Cecilia Pando c/ Revista Barcelona,Agustina Del Campo,2017,2017-10,Documento de posición,8,,"Agustina Del Campo, “Amicus curiae ante la Corte Suprema en el caso Cecilia Pando c/ Revista Barcelona”, Documento de posición No. 8, Centro de Estudios en Libertad de Expresión (CELE), Buenos Aires (2017)",https://www.palermo.edu/cele/libertad-de-expresion/AMICUS_PANDO_VERSION_FINAL.pdf,
46,Hacia una internet libre de censura II. Perspectivas en América Latina,Agustina Del Campo,2017,2017-02,Compilaciones,II,ESP,"Agustina Del Campo, “Hacia una internet libre de censura II. Perspectivas en América Latina”, Compilaciones No. II (ESP), Centro de Estudios en Libertad de Expresión (CELE), Buenos Aires (2017)",https://www.palermo.edu/cele/pdf/investigaciones/Hacia_una_internet_libre_de_censura_II.pdf,
45,Towards an Internet Free of Censorship II. Perspectives in Latin America,Agustina Del Campo,2017,2017-02,Compilaciones,II,ENG,"Agustina Del Campo, “Towards an Internet Free of Censorship II. Perspectives in Latin America”, Compilaciones No. II (ENG), Centro de Estudios en Libertad de Expresión (CELE), Buenos Aires (2017)",https://www.palermo.edu/cele/pdf/investigaciones/Towards_an_Internet_Free_of_Censorship_II_10-03_FINAL.pdf,
44,Servicios Over-the-Top: principios fundamentales para su tratamiento regulatorio en Argentina,Maia Levy Daniel,2016,2016-11,Artículo de investigación,28,,"Maia Levy Daniel, “Servicios Over-the-Top: principios fundamentales para su tratamiento regulatorio en Argentina”, Artículo de investigación No. 28, Centro de Estudios en Libertad de Expresión (CELE), Buenos Aires (2016)",https://www.palermo.edu/cele/pdf/investigaciones/Policy_paper-Servicios_OTT-MLD.pdf,
43,Comentarios a los Principios sobre la protección de la libertad de expresión y la privacidad de Article 19,CELE,2016,2016-08,Documento de posición,7,,"CELE, “Comentarios a los Principios sobre la protección de la libertad de expresión y la privacidad de Article 19”, Documento de posición No. 7, Centro de Estudios en Libertad de Expresión (CELE), Buenos Aires (2016)",https://www.palermo.edu/cele/pdf/Comentarios-del-CELE-Principios-Article-19.pdf,
42,Acceso a internet en Argentina. Lecciones aprendidas del plan Argentina Conectada,Verónica Ferrari,2016,2016-07,Artículo de investigación,27,,"Verónica Ferrari, “Acceso a internet en Argentina. Lecciones aprendidas del plan Argentina Conectada”, Artículo de investigación No. 27, Centro de Estudios en Libertad de Expresión (CELE), Buenos Aires (2016)",https://www.palermo.edu/cele/pdf/investigaciones/Acceso_a_internet_en_Argentina.pdf,
41,El delito de 'grooming' en la legislación penal actual y proyectada en Argentina,Daniela Schnidrig,2016,2016-03,Artículo de investigación,26,,"Daniela Schnidrig, “El delito de 'grooming' en la legislación penal actual y proyectada en Argentina”, Artículo de investigación No. 26, Centro de Estudios en Libertad de Expresión (CELE), Buenos Aires (2016)",https://www.palermo.edu/cele/pdf/investigaciones/Informe-Anteproyecto-Codigo-Penal.pdf,
40,Internet y derechos humanos II. Aportes para la discusión en América Latina.,Eduardo Bertoni,2016,2016-02,Compilaciones,II,ESP,"Eduardo Bertoni, “Internet y derechos humanos II. Aportes para la discusión en América Latina.”, Compilaciones No. II (ESP), Centro de Estudios en Libertad de Expresión (CELE), Buenos Aires (2016)",https://www.palermo.edu/cele/pdf/InternetyDDHHII.pdf,
39,La regulación de la pornografía no consentida en Argentina,Paula Vargas de Brea,2015,2015-12,Artículo de investigación,25,,"Paula Vargas de Brea, “La regulación de la pornografía no consentida en Argentina”, Artículo de investigación No. 25, Centro de Estudios en Libertad de Expresión (CELE), Buenos Aires (2015)",https://www.palermo.edu/cele/pdf/Paper-regulacion-pornografia.pdf,
38,Responsabilidad de intermediarios y derecho al olvido. Aportes para la discusión legislativa en Argentina,Verónica Ferrari y Daniela Schnidrig,2015,2015-06,Documento de posición,6,,"Verónica Ferrari y Daniela Schnidrig, “Responsabilidad de intermediarios y derecho al olvido. Aportes para la discusión legislativa en Argentina”, Documento de posición No. 6, Centro de Estudios en Libertad de Expresión (CELE), Buenos Aires (2015)",https://www.palermo.edu/cele/pdf/Policy_Paper_Derecho_al_Olvido.pdf,
37,Mercados propiedad expresión y uso personal: el sistema de derechos de autor,Hiram A. Meléndez Juarbe,2015,2015-02,Artículo de investigación,24,,"Hiram A. Meléndez Juarbe, “Mercados propiedad expresión y uso personal: el sistema de derechos de autor”, Artículo de investigación No. 24, Centro de Estudios en Libertad de Expresión (CELE), Buenos Aires (2015)",https://www.palermo.edu/cele/pdf/MERCADOS-PROPIEDAD-EXPRESION-Y-USO-PERSONAL.pdf,
36,"Contribuciones al informe de UNESCO ""Fostering Freedom Online: the Role of Internet Intermediaries""","MacKinnon Rebecca, Hickok Elonnai, Bar Allon and Lim, Hae-in",2015,2015-01,Informe legislativo,,,"MacKinnon Rebecca, Hickok Elonnai, Bar Allon and Lim, Hae-in, “Contribuciones al informe de UNESCO ""Fostering Freedom Online: the Role of Internet Intermediaries""”, Informe legislativo No. , Centro de Estudios en Libertad de Expresión (CELE), Buenos Aires (2015)",https://unesdoc.unesco.org/ark:/48223/pf0000231162,
35,"El ""internet de las cosas"": más internet que otra cosa",Carlos Cortés,2014,2014-12,Artículo de investigación,23,,"Carlos Cortés, “El ""internet de las cosas"": más internet que otra cosa”, Artículo de investigación No. 23, Centro de Estudios en Libertad de Expresión (CELE), Buenos Aires (2014)",https://www.palermo.edu/cele/pdf/Paper-IoT-DEF.pdf,
34,La gobernanza de Internet: la trampa de las formas,Carlos Cortés,2014,2014-09,Artículo de investigación,22,,"Carlos Cortés, “La gobernanza de Internet: la trampa de las formas”, Artículo de investigación No. 22, Centro de Estudios en Libertad de Expresión (CELE), Buenos Aires (2014)",https://www.palermo.edu/cele/pdf/CELE_GobernanzaDeInternet.pdf,
33,Amicus curiae a la Corte Suprema en el caso María Belén Rodríguez c/ Google,Eduardo Andrés Bertoni,2014,2014-08,Documento de posición,5,,"Eduardo Andrés Bertoni, “Amicus curiae a la Corte Suprema en el caso María Belén Rodríguez c/ Google”, Documento de posición No. 5, Centro de Estudios en Libertad de Expresión (CELE), Buenos Aires (2014)",https://www.palermo.edu/cele/pdf/PRESENTA-AMICUS-CURIAE-BERTONI.pdf,
32,Colaboración del CELE en el capítulo sobre América Latina y el Caribe del informe de la Unesco World Trends in Freedom of Expression and Media Development,UNESCO Office Montevideo and Regional Bureau for Science in Latin America and the Caribbean,2014,2014-08,Trabajos publicados,,,"UNESCO Office Montevideo and Regional Bureau for Science in Latin America and the Caribbean, “Colaboración del CELE en el capítulo sobre América Latina y el Caribe del informe de la Unesco World Trends in Freedom of Expression and Media Development”, Trabajos publicados No. , Centro de Estudios en Libertad de Expresión (CELE), Buenos Aires (2014)",https://unesdoc.unesco.org/ark:/48223/pf0000227740,
31,Pedido de audiencia temática a la CIDH sobre el impacto de internet en la defensa y el ejercicio de los derechos humanos,Dr. Eduardo Bertoni,2014,2014-08,Documento de posición,4,,"Dr. Eduardo Bertoni, “Pedido de audiencia temática a la CIDH sobre el impacto de internet en la defensa y el ejercicio de los derechos humanos”, Documento de posición No. 4, Centro de Estudios en Libertad de Expresión (CELE), Buenos Aires (2014)",https://www.palermo.edu/cele/pdf/Solicitud-Audiencia-Internet-DDHH.pdf,
30,Internet en Argentina: ¿cómo estamos hoy? Mapeo de la situación en materia de acceso regulación y derechos humanos,Eduardo Bertoni,2014,2014-07,Artículo de investigación,20,,"Eduardo Bertoni, “Internet en Argentina: ¿cómo estamos hoy? Mapeo de la situación en materia de acceso regulación y derechos humanos”, Artículo de investigación No. 20, Centro de Estudios en Libertad de Expresión (CELE), Buenos Aires (2014)",https://www.palermo.edu/cele/pdf/investigaciones/Mapping-ARG-CELE.pdf,
29,Carta de Derechos Humanos y Principios de Internet,CELE,2014,2014-02,Documento de posición,3,,"CELE, “Carta de Derechos Humanos y Principios de Internet”, Documento de posición No. 3, Centro de Estudios en Libertad de Expresión (CELE), Buenos Aires (2014)",https://www.palermo.edu/cele/pdf/Carta-DDHH-&-Internet-Espanol.pdf,
28,Hacia una política integral de gestión de la información pública.Todo lo que siempre quisimos saber sobre archivos (y nunca nos animamos a preguntarle al acceso a la información),Natalia Torres,2014,2014-02,Artículo de investigación,19,,"Natalia Torres, “Hacia una política integral de gestión de la información pública.Todo lo que siempre quisimos saber sobre archivos (y nunca nos animamos a preguntarle al acceso a la información)”, Artículo de investigación No. 19, Centro de Estudios en Libertad de Expresión (CELE), Buenos Aires (2014)",https://www.palermo.edu/cele/pdf/Hacia_una_Politica_Integral.pdf,
